{
  "dataset_version": "moex_approved_universe_current_v1",
  "roll_policy_version": "front_liquidity_oi_v1",
  "adjustment_policy_version": "backward_current_anchor_additive_v1",
  "instrument_id": "BR",
  "timeframe": "15m",
  "run_id": "continuous_front_refresh",
  "started_at": "2026-04-28T00:00:00Z",
  "completed_at": "2026-04-28T00:00:01Z",
  "input_row_count": 4,
  "output_row_count": 2,
  "roll_event_count": 1,
  "missing_active_bar_count": 0,
  "duplicate_key_count": 0,
  "timeline_error_count": 0,
  "ohlc_error_count": 0,
  "negative_volume_oi_count": 0,
  "missing_reference_price_count": 0,
  "future_causality_violation_count": 0,
  "gap_abs_max": 2.0,
  "gap_abs_mean": 2.0,
  "blocked_reason": null,
  "status": "PASS"
}
